title,url,thumbnail,channel name,description
I Survived On €0.01 For 1 Week,https://www.youtube.com/watch?v=7_hVt4Eq0qw,https://i.ytimg.com/vi/7_hVt4Eq0qw/hqdefault.jpg?sqp=-oaymwEcCPYBEIoBSFXyq4qpAw4IARUAAIhCGAFwAcABBg==&rs=AOn4CLD6Mb4A0PH6uT-I2FCQ4y5_1w9AGQ,Ryan Trahan,1 penny. 1 week. 1 mission. donate here - https://give.water.org/f/penny/
"$50,000 Crystal Treasure Hunt",https://www.youtube.com/watch?v=eFmpqhvedt8,https://i.ytimg.com/vi/eFmpqhvedt8/hqdefault.jpg?sqp=-oaymwEcCPYBEIoBSFXyq4qpAw4IARUAAIhCGAFwAcABBg==&rs=AOn4CLCupORcK-QpF_9_lcTHCBntLNvf4g,Dude Perfect,Crystal hunting ROUND 2! ► Thanks for subscribing! - http://bit.ly/SubDudePerfect ► Come see us in YOUR city! - http://dudeperfect.com/tour/ MUSIC: “Golden” Performed by Outasight...
RIVERS VS LA RIVERS | LA VELADA DEL AÑO 3,https://www.youtube.com/watch?v=jcHgRIWgxcc,,Ibai,00:00 Presentación y entradas 09:00 Round 1 12:05 Round 2 15:06 Round 3 19:22 Veredicto del combate 22:49 Entrevista al ganador Extraído de mi canal de TWITCH: https://www.twitch.tv/ibai/...
Olivia Rodrigo - vampire (Official Music Video),https://www.youtube.com/watch?v=RlPNh_PBZb4,,Olivia Rodrigo,Listen to vampire out now: https://OliviaRodrigo.lnk.to/vampire Store: https://OliviaRodrigo.lnk.to/store Create a Short to vampire: https://yt.be/vampireOR2 Follow Olivia Rodrigo: Instagram:...
The Most Misunderstood Concept in Physics,https://www.youtube.com/watch?v=DxL2HoqLbyA,,Veritasium,"One of the most important, yet least understood, concepts in all of physics. Head to https://brilliant.org/veritasium to start your free 30-day trial, and the first 200 people get 20% off an..."
Juvenile: Tiny Desk Concert,https://www.youtube.com/watch?v=kes2P4IC2bQ,,NPR Music,"NPR Music is celebrating Black Music Month with an array of brand new Tiny Desk concerts. Together, these artists represent the past, present and future of Black music. This month of carefully..."
Meet my Boyfriend!,https://www.youtube.com/watch?v=RwfzvfFkyBw,,HJ Evelyn,SURPRISE...the moment you all have been waiting for :p INSTAGRAM: https://www.instagram.com/HJEVELYN/ Shop everything mentioned in this video here: https://shopmy.us/collections/200205 Tekla...
Using 0.00001% of my Power in Gang Beasts!,https://www.youtube.com/watch?v=UVQCDzphOkg,,Socksfor2,subscribe i guess? idk Using 0.00001% of my Power in Gang Beasts! Twitter → https://bit.ly/2MrebAu Reddit → https://bit.ly/3apoz3C Discord → https://bit.ly/3aoc08U Insta → https://b...
50 Kids vs 5 Adults Basketball,https://www.youtube.com/watch?v=k4zMUSXvaY0,,Jesser,Today we answer the age old question... who would win in a basketball game where 5 adults play against 50 kids? We'll answer that and much more in this video! 100 Basketball Players Compete...
I Transformed a Nether Portal in Survival Minecraft,https://www.youtube.com/watch?v=ZUGrmj7gdXI,,Wenzo,"I built the World's Biggest Nether Portal on this Minecraft SMP, and showed it to my friends. This is Minecraft's Largest Nether Portal - Like ParrotX2 videos and the LifeSteal SMP, a Minecraft..."
